,authors_full,affiliation
108,"Zhuo, SJ; Shao, MW; Lee, ST","Soochow Univ, Inst Funct Nano & Soft Mat FUNSOM, Suzhou 215123, Jiangsu, Peoples R China; Soochow Univ, Jiangsu Key Lab Carbon Based Funct Mat & Devices, Suzhou 215123, Jiangsu, Peoples R China; Anhui Normal Univ, Coll Chem & Mat Sci, Anhui Key Lab Funct Mol Solids, Wuhu 241000, Peoples R China; City Univ Hong Kong, Ctr Super Diamond & Adv Films, Hong Kong, Hong Kong, Peoples R China; City Univ Hong Kong, Dept Phys & Mat Sci, Hong Kong, Hong Kong, Peoples R China"
109,"Oulton, RF; Sorger, VJ; Zentgraf, T; Ma, RM; Gladden, C; Dai, L; Bartal, G; Zhang, X","Univ Calif Berkeley, NSF Nanoscale Sci & Engn Ctr, Berkeley, CA 94720 USA; Univ Calif Berkeley, Lawrence Berkeley Lab, Div Mat Sci, Berkeley, CA 94720 USA; Peking Univ, Sch Phys, Beijing 100871, Peoples R China; Peking Univ, State Key Lab Mesoscop Phys, Beijing 100871, Peoples R China"
110,"Hafner, J","Univ Vienna, Fac Phys, A-1090 Vienna, Austria; Univ Vienna, Ctr Computat Mat Sci, A-1090 Vienna, Austria"
111,"Jia, QY; Ge, JC; Liu, WM; Zheng, XL; Chen, SQ; Wen, YM; Zhang, HY; Wang, PF","Chinese Acad Sci, Key Lab Photochem Convers & Optoelect Mat, Tech Inst Phys & Chem, Beijing 100190, Peoples R China; Chinese Acad Sci, CityU CAS Joint Lab Funct Mat & Devices, Tech Inst Phys & Chem, Beijing 100190, Peoples R China; Univ Chinese Acad Sci, Sch Future Technol, Beijing 100049, Peoples R China"
112,"Di, TM; Zhu, BC; Cheng, B; Yu, JG; Xu, JS","Wuhan Univ Technol, State Key Lab Adv Technol Mat Synth & Proc, Wuhan 430070, Peoples R China; King Abdulaziz Univ, Fac Sci, Dept Phys, Jeddah 21589, Saudi Arabia; Queensland Univ Technol, Sch Chem Phys & Mech Engn, Brisbane, Qld 4001, Australia"
113,"Li, JT; Cushing, SK; Zheng, P; Senty, T; Meng, FK; Bristow, AD; Manivannan, A; Wu, NQ","W Virginia Univ, Dept Mech & Aerosp Engn, Morgantown, WV 26506 USA; W Virginia Univ, Dept Phys & Astron, Morgantown, WV 26506 USA; US DOE, Natl Energy Technol Lab, Morgantown, WV 26507 USA"
114,"Abdi-Jalebi, M; Andaji-Garmaroudi, Z; Cacovich, S; Stavrakas, C; Philippe, B; Richter, JM; Alsari, M; Booker, EP; Hutter, EM; Pearson, AJ; Lilliu, S; Savenije, TJ; Rensmo, H; Divitini, G; Ducati, C; Friend, RH; Stranks, SD","Univ Cambridge, Dept Phys, Cavendish Lab, JJ Thomson Ave, Cambridge CB3 0HE, England; Univ Cambridge, Dept Mat Sci & Met, 27 Charles Babbage Rd, Cambridge CB3 0FS, England; Uppsala Univ, Dept Phys & Astron, Box 516, S-75120 Uppsala, Sweden; Delft Univ Technol, Dept Chem Engn, van der Maasweg 9, NL-2629 HZ Delft, Netherlands; Univ Sheffield, Dept Phys & Astron, Sheffield S3 7RH, S Yorkshire, England; UAE Ctr Crystallog, Abu Dhabi, U Arab Emirates"
115,"KRESSE, G; HAFNER, J","VIENNA TECH UNIV, INST THEORET PHYS, WIEDNER HAUPTSTR 8-10, A-1040 VIENNA, AUSTRIA"
116,"PERDEW, JP; WANG, Y","TULANE UNIV, QUANTUM THEORY GRP, NEW ORLEANS, LA 70118 USA"
117,"Lu, NP; Zhang, PF; Zhang, QH; Qiao, RM; He, Q; Li, HB; Wang, YJ; Guo, JW; Zhang, D; Duan, Z; Li, ZL; Wang, M; Yang, SZ; Yan, MZ; Arenholz, E; Zhou, SY; Yang, WL; Gu, L; Nan, CW; Wu, J; Tokura, Y; Yu, P","Tsinghua Univ, State Key Lab Low Dimens Quantum Phys, Beijing 100084, Peoples R China; Tsinghua Univ, Dept Phys, Beijing 100084, Peoples R China; Chinese Acad Sci, Beijing Natl Lab Condensed Matter Phys, Inst Phys, Beijing 100190, Peoples R China; Tsinghua Univ, Sch Mat Sci & Engn, State Key Lab New Ceram & Fine Proc, Beijing 100084, Peoples R China; Lawrence Berkeley Natl Lab, Adv Light Source, Berkeley, CA 94720 USA; Univ Durham, Dept Phys, Durham DH1 3LE, England; Collaborat Innovat Ctr Quantum Matter, Beijing 100084, Peoples R China; RIKEN, Ctr Emergent Matter Sci, Wako, Saitama 351198, Japan"
118,"Wang, L; Zhu, SJ; Wang, HY; Qu, SN; Zhang, YL; Zhang, JH; Chen, QD; Xu, HL; Han, W; Yang, B; Sun, HB","Jilin Univ, Coll Elect Sci & Engn, State Key Lab Integrated Optoelect, Changchun 130012, Peoples R China; Jilin Univ, Coll Chem, State Key Lab Supramol Struct & Mat, Changchun 130012, Peoples R China; Jilin Univ, Coll Phys, Changchun 130012, Peoples R China; Chinese Acad Sci, State Key Lab Luminescence & Applicat, Changchun Inst Opt Fine Mech & Phys, Changchun 130033, Peoples R China"
119,"Xiao, JD; Shang, QC; Xiong, YJ; Zhang, Q; Luo, Y; Yu, SH; Jiang, HL","Univ Sci & Technol China, Hefei Natl Lab Phys Sci Microscale, Collaborat Innovat Ctr Suzhou Nano Sci & Technol, CAS Key Lab Soft Matter Chem,Dept Chem, Hefei 230026, Anhui, Peoples R China; Univ Sci & Technol China, Synerget Innovat Ctr Quantum Informat & Quantum P, Dept Chem Phys, Hefei Sci Ctr,CAS, Hefei 230026, Anhui, Peoples R China"
120,"Zhang, SL; Guo, SY; Chen, ZF; Wang, YL; Gao, HJ; Gomez-Herrero, J; Ares, P; Zamora, F; Zhu, Z; Zeng, HB","Nanjing Univ Sci & Technol, Minist Ind & Informat Technol, MIIT Key Lab Adv Display Mat & Devices, Inst Optoelect & Nanomat, Nanjing 210094, Jiangsu, Peoples R China; Univ Puerto Rico, Dept Chem, Inst Funct Nanomat, San Juan, PR 00931 USA; Chinese Acad Sci, Inst Phys, Beijing 100190, Peoples R China; Chinese Acad Sci, Univ Chinese Acad Sci, Beijing 100190, Peoples R China; Univ Autonoma Madrid, Dept Fis Mat Condensada, E-28049 Madrid, Spain; Univ Autonoma Madrid, Dept Quim Inorgan, E-28049 Madrid, Spain; Univ Calif Santa Barbara, Dept Mat, Santa Barbara, CA 93106 USA"
121,"Wang, W; Fang, JJ; Shao, SF; Lai, M; Lu, CH","Nanjing Univ Informat Sci & Technol, Sch Phys & Optoelect Engn, Jiangsu Key Lab Optoelect Detect Atmosphere & Oce, Nanjing 210044, Jiangsu, Peoples R China; Nanjing Tech Univ, Jiangsu Collaborat Innovat Ctr Adv Inorgan Funct, Nanjing 210009, Jiangsu, Peoples R China"
122,"Nagaosa, N; Sinova, J; Onoda, S; MacDonald, AH; Ong, NP","Univ Tokyo, Dept Appl Phys, Tokyo 1138656, Japan; RIKEN, ASI, CERG, Wako, Saitama 3510198, Japan; RIKEN, ASI, CMRG, Wako, Saitama 3510198, Japan; Texas A&M Univ, Dept Phys, College Stn, TX 77843 USA; Inst Phys ASCR, Prague 16253 6, Czech Republic; RIKEN, ASI, Condensed Matter Theory Lab, Wako, Saitama 3510198, Japan; Univ Texas Austin, Dept Phys, Austin, TX 78712 USA; Princeton Univ, Dept Phys, Princeton, NJ 08544 USA"
123,"Ge, JC; Lan, MH; Zhou, BJ; Liu, WM; Guo, L; Wang, H; Jia, QY; Niu, GL; Huang, X; Zhou, HY; Meng, XM; Wang, PF; Lee, CS; Zhang, WJ; Han, XD","Chinese Acad Sci, TIPC, Key Lab Photochem Convers & Optoelectron Mat, Beijing 100190, Peoples R China; City Univ Hong Kong, Ctr Super Diamond & Adv Films COSDAF, Hong Kong 999077, Hong Kong, Peoples R China; City Univ Hong Kong, Dept Phys & Mat Sci, Hong Kong 999077, Hong Kong, Peoples R China; Beijing Univ Technol, Inst Microstructure & Properties Adv Mat, Beijing 100124, Peoples R China"
124,"Xie, GC; Zhang, K; Guo, BD; Liu, Q; Fang, L; Gong, JR","Natl Ctr Nanosci & Technol, Beijing 100190, Peoples R China; Chongqing Univ, Dept Appl Phys, Chongqing 400044, Peoples R China"
125,"Zhu, FF; Chen, WJ; Xu, Y; Gao, CL; Guan, DD; Liu, CH; Qian, D; Zhang, SC; Jia, JF","Shanghai Jiao Tong Univ, Dept Phys & Astron, Minist Educ, Key Lab Artificial Struct & Quantum Control, Shanghai 200240, Peoples R China; Stanford Univ, Dept Phys, Stanford, CA 94305 USA; Tsinghua Univ, Dept Phys, Beijing 100084, Peoples R China; Tsinghua Univ, Inst Adv Study, Beijing 100084, Peoples R China; Collaborat Innovat Ctr Quantum Matter, Beijing 100084, Peoples R China; Collaborat Innovat Ctr Adv Microstruct, Nanjing 210093, Jiangsu, Peoples R China"
126,"Mak, KF; Lee, C; Hone, J; Shan, J; Heinz, TF","Columbia Univ, Dept Phys, New York, NY 10027 USA; Columbia Univ, Dept Elect Engn, New York, NY 10027 USA; Sungkyunkwan Univ, Dept Mech Engn, Suwon 440746, South Korea; Sungkyunkwan Univ, SKKU Adv Inst Nanotechnol SAINT, Suwon 440746, South Korea; Columbia Univ, Dept Mech Engn, New York, NY 10027 USA; Case Western Reserve Univ, Dept Phys, Cleveland, OH 44106 USA"
127,"Ran, JR; Ma, TY; Gao, GP; Du, XW; Qiao, SZ","Univ Adelaide, Sch Chem Engn, Adelaide, SA 5005, Australia; Queensland Univ Technol, Sch Chem, Phys & Mech Engn Fac, Brisbane, Qld 4001, Australia; Tianjin Univ, Sch Mat Sci & Engn, Tianjin 300072, Peoples R China"
128,"Miao, JL; Zhang, FJ","Beijing Jiaotong Univ, Minist Educ, Key Lab Luminescence & Opt Informat, Beijing 100044, Peoples R China"
129,"Yu, YF; Nam, GH; He, QY; Wu, XJ; Zhang, K; Yang, ZZ; Chen, JZ; Ma, QL; Zhao, MT; Liu, ZQ; Ran, FR; Wang, XZ; Li, H; Huang, X; Li, B; Xiong, QH; Zhang, Q; Liu, Z; Gu, L; Du, YH; Huang, W; Zhang, H","Nanyang Technol Univ, Sch Mat Sci & Engn, Ctr Programmable Mat, Singapore, Singapore; Tianjin Univ, Sch Sci, Dept Chem, Tianjin, Peoples R China; Collaborat Innovat Ctr Chem Sci & Engn, Tianjin, Peoples R China; Nanyang Technol Univ, Interdisciplinary Grad Sch, HealthTech NTU, Singapore, Singapore; Nanyang Technol Univ, Sch Elect & Elect Engn, Singapore, Singapore; Chinese Acad Sci, Beijing Natl Lab Condensed Matter Phys, Inst Phys, Beijing, Peoples R China; Nanjing Tech Univ NanjingTech, KLOFE, Nanjing, Jiangsu, Peoples R China; Nanjing Tech Univ NanjingTech, IAM, Nanjing, Jiangsu, Peoples R China; Nanyang Technol Univ, Sch Phys & Math Sci, Div Phys & Appl Phys, Singapore, Singapore; ASTAR, Inst Mat Res & Engn, Singapore, Singapore; Collaborat Innovat Ctr Quantum Matter, Beijing, Peoples R China; Univ Chinese Acad Sci, Sch Phys Sci, Beijing, Peoples R China; ASTAR, Inst Chem & Engn Sci, Singapore, Singapore; Nanjing Univ Posts & Telecommun, Key Lab Organ Elect & Informat Displays, Nanjing, Jiangsu, Peoples R China; Nanjing Univ Posts & Telecommun, Inst Adv Mat, Jiangsu Natl Synergist Innovat Ctr Adv Mat SICAM, Nanjing, Jiangsu, Peoples R China; NPU, SIFE, Xian, Shaanxi, Peoples R China"
130,"Lee, Y; Kwon, J; Hwang, E; Ra, CH; Yoo, WJ; Ahn, JH; Park, JH; Cho, JH","Sungkyunkwan Univ, Sch Chem Engn, SKKU Adv Inst Nanotechnol SAINT, Suwon 440746, South Korea; Sungkyunkwan Univ, SKKU Adv Inst Nanotechnol SAINT, Suwon 440746, South Korea; Sungkyunkwan Univ, Sch Chem Engn, Suwon 440746, South Korea; Sungkyunkwan Univ, Dept Phys, SKKU Adv Inst Nanotechnol SAINT, Suwon 440746, South Korea; Yonsei Univ, Sch Elect & Elect Engn, Seoul 120749, South Korea"
131,"Prodan, E; Radloff, C; Halas, NJ; Nordlander, P","Rice Univ, Dept Chem, Houston, TX 77251 USA; Rice Univ, Dept Phys, Houston, TX 77251 USA; Rice Univ, Dept Elect & Comp Engn, Houston, TX 77251 USA; Rice Univ, Rice Quantum Inst, Houston, TX 77251 USA"
132,"Ding, QQ; Zhang, Y; Chen, X; Fu, XQ; Chen, DK; Chen, SJ; Gu, L; Wei, F; Bei, HB; Gao, YF; Wen, MR; Li, JX; Zhang, Z; Zhu, T; Ritchie, RO; Yu, Q","Zhejiang Univ, Ctr Electron Microscopy, Hangzhou, Zhejiang, Peoples R China; Zhejiang Univ, State Key Lab Silicon Mat, Dept Mat Sci & Engn, Hangzhou, Zhejiang, Peoples R China; Georgia Inst Technol, Woodruff Sch Mech Engn, Atlanta, GA 30332 USA; Tsinghua Univ, Beijing Key Lab Green Chem React Engn & Technol, Dept Chem Engn, Beijing, Peoples R China; Chinese Acad Sci, Beijing Natl Lab Condensed Matter Phys, Inst Phys, Beijing, Peoples R China; Chinese Acad Sci, Collaborat Innovat Ctr Quantum Matter, Inst Phys, Beijing, Peoples R China; Univ Tennessee, Dept Mat Sci & Engn, Knoxville, TN 37996 USA; Oak Ridge Natl Lab, Mat Sci & Technol Div, Oak Ridge, TN USA; Lawrence Berkeley Natl Lab, Mat Sci Div, Berkeley, CA 94720 USA; Univ Calif Berkeley, Dept Mat Sci & Engn, Berkeley, CA 94720 USA"
133,"Chen, HT; Padilla, WJ; Zide, JMO; Gossard, AC; Taylor, AJ; Averitt, RD","Los Alamos Natl Lab, Ctr Integrated Nanotechnol, Mat Phys & Applicat Div, Los Alamos, NM 87545 USA; Univ Calif Santa Barbara, Dept Mat, Santa Barbara, CA 93106 USA"
134,"Hwang, HY; Iwasa, Y; Kawasaki, M; Keimer, B; Nagaosa, N; Tokura, Y","RIKEN Adv Sci Inst, Correlated Elect Res Grp CERG, Wako, Saitama 3510198, Japan; RIKEN Adv Sci Inst, Cross Correlated Mat Res Grp CMRG, Wako, Saitama 3510198, Japan; Stanford Univ, Dept Appl Phys, Stanford, CA 94305 USA; Stanford Univ, Stanford Inst Mat & Energy Sci, Stanford, CA 94305 USA; Japan Sci & Technol Agcy JST, CREST, Tokyo 1020075, Japan; Univ Tokyo, Dept Appl Phys, Bunkyo Ku, Tokyo 1138656, Japan; Univ Tokyo, Quantum Phase Elect Ctr QPEC, Bunkyo Ku, Tokyo 1138656, Japan; Max Planck Inst Solid State Res, D-70569 Stuttgart, Germany; Japan Sci & Technol Agcy JST, Multiferro Project, ERATO, Tokyo 1138656, Japan"
135,"Xing, GC; Mathews, N; Lim, SS; Yantara, N; Liu, XF; Sabba, D; Gratzel, M; Mhaisalkar, S; Sum, TC","Nanyang Technol Univ, Sch Phys & Math Sci, Div Phys & Appl Phys, Singapore 637371, Singapore; Nanyang Technol Univ, Sch Mat Sci & Engn, Singapore 639798, Singapore; NTU ERI N, Energy Res Inst, Singapore 637553, Singapore; Singapore Berkeley Res Initiat Sustainable Energy, Singapore 138602, Singapore; Swiss Fed Inst Technol, Dept Chem & Chem Engn, Lab Photon & Interfaces, CH-1015 Lausanne, Switzerland"
136,"Sun, WT; Yu, Y; Pan, HY; Gao, XF; Chen, Q; Peng, LM","Peking Univ, Key Lab Phys & Chem Nanodevices, Beijing 100871, Peoples R China; Peking Univ, Dept Elect, Beijing 100871, Peoples R China"
137,"Son, YW; Cohen, ML; Louie, SG","Univ Calif Berkeley, Dept Phys, Berkeley, CA 94720 USA; Lawrence Berkeley Natl Lab, Div Mat Sci, Berkeley, CA 94720 USA"
138,"Pelaz, B; Alexiou, CH; Alvarez -Puebla, RA; Alves, F; Andrews, AM; Ashraf, S; Balogh, LP; Ballerini, L; Bestetti, A; Brendel, C; Bosi, S; Carril, M; Chan, WCW; Chen, CY; Chen, XD; Chen, XY; Cheng, Z; Cui, DX; Du, JZ; Dullin, C; Escudero, A; Feliu, N; Gao, MY; George, M; Gogotsi, Y; Grunweller, A; Gu, ZW; Halas, NJ; Hampp, N; Hartmann, RK; Hersam, MC; Hunziker, P; Jian, J; Jiang, XY; Jungebluth, P; Kadhiresan, P; Kataoka, K; Khademhosseini, A; Kopecek, J; Kotov, NA; Krug, HF; Lee, DS; Lehr, CM; Leong, KW; Liang, XJ; Lim, ML; Liz-Marzan, LM; Ma, XM; Macchiarini, P; Meng, H; Mohwald, H; Mulvaney, P; Nel, AE; Nie, SM; Nordlander, P; Okano, T; Oliveira, J; Park, TH; Penner, RM; Prato, M; Puntes, V; Rotello, VM; Samarakoon, A; Schaak, RE; Shen, YQ; Sjoqvist, S; Skirtach, AG; Soliman, MG; Stevens, MM; Sung, HW; Tang, BZ; Tietze, R; Udugama, BN; VanEpps, JS; Weil, T; Weiss, PS; Willner, I; Wu, YZ; Yang, LL; Yue, Z; Zhang, Q; Zhang, Q; Zhang, XE; Zhao, YL; Zhou, X; Parak, WJ","Univ Marburg, Fachbereich Phys, D-35037 Marburg, Germany; Univ Marburg, Fachbereich Med, D-35037 Marburg, Germany; Univ Marburg, Fachbereich Pharm, D-35037 Marburg, Germany; Univ Marburg, Dept Chem, D-35037 Marburg, Germany; Univ Hosp Erlangen, ENT Dept, Sect Expt Oncol & Nanomed, Else Kroner Fresenius Stiftung Professorship Nano, D-91054 Erlangen, Germany; Univ Rovira & Virgili, Dept Phys Chem, Tarragona 43007, Spain; ICREA, Pg Lluis Companys 23, Barcelona 08010, Spain; Univ Med Ctr Groningen, Dept Haematol & Med Oncol, D-37075 Gottingen, Germany; Univ Med Ctr Groningen, Dept Diagnost & Intervent Radiol, D-37075 Gottingen, Germany; Max Planck Inst Expt Med, Dept Mol Biol Neuronal Signals, D-37075 Gottingen, Germany; Univ Calif Los Angeles, Calif NanoSyst Inst, Los Angeles, CA 90095 USA; Univ Calif Los Angeles, Dept Chem & Biochem, Los Angeles, CA 90095 USA; Univ Calif Los Angeles, Dept Psychiat, Los Angeles, CA 90095 USA; Univ Calif Los Angeles, Semel Inst Neurosci & Human Behav, Los Angeles, CA 90095 USA; Univ Calif Los Angeles, Div NanoMed, Los Angeles, CA 90095 USA; Univ Calif Los Angeles, Ctr Environm Impact Nanotechnol, Los Angeles, CA 90095 USA; Univ Calif Los Angeles, Dept Mat Sci & Engn, Los Angeles, CA 90095 USA; AA Nanomed & Nanotechnol Consultants, N Andover, MA 01845 USA; Scuola Int Super Studi Avanzati, SISSA ISAS, I-34136 Trieste, Italy; Univ Melbourne, Sch Chem, Parkville, Vic 3010, Australia; Univ Melbourne, Bio21 Inst, Parkville, Vic 3010, Australia; Univ Trieste, Dept Chem & Pharmaceut Sci, I-34127 Trieste, Italy; CIC biomaGUNE, Paseo de Miramon 182, San Sebastian 20014, Spain; Ikerbasque, Basque Fdn Sci, Bilbao 48013, Spain; Univ Toronto, Inst Biomat & Biomed Engn, Toronto, ON M5S 3G9, Canada; Natl Ctr Nanosci & Technol China, CAS Ctr Excellence Nanosci, Beijing 100190, Peoples R China; Natl Ctr Nanosci & Technol China, CAS Key Lab Biomed Effects Nanomat & Nanosafety, Beijing 100190, Peoples R China; Nanyang Technol Univ, Sch Mat Sci & Engn, Singapore 639798, Singapore; Natl Inst Biomed Imaging & Bioengn, Lab Mol Imaging & Nanomed, NIH, Bethesda, MD 20892 USA; Stanford Univ, Canary Ctr Stanford Canc Early Detect, Mol Imaging Program Stanford, Stanford, CA 94305 USA; Stanford Univ, Canary Ctr Stanford Canc Early Detect, Bio X Program, Stanford, CA 94305 USA; Shanghai Jiao Tong Univ, Natl Ctr Translat Med, Sch Elect Informat & Elect Engn, Dept Instrument Sci & Engn,Inst Nano Biomed & Eng, Shanghai 200240, Peoples R China; Tongji Univ, Sch Mat Sci & Engn, Dept Polymer Mat, Shanghai, Peoples R China; Univ Seville, CSIC, Inst Ciencia Mat & Sevilla, Seville 41092, Spain; Karolinska Inst, Dept Clin Sci Intervent & Technol CLINTEC, Stockholm 14186, Sweden; Chinese Acad Sci, Inst Chem, Beijing 100190, Peoples R China; Nanion, D-80636 Munich, Germany; Sichuan Univ, Coll Polymer Sci & Engn, Chengdu 610000, Peoples R China; Drexel Univ, Dept Mat Sci & Engn, Philadelphia, PA 19104 USA; Drexel Univ, AJ Drexel Nanomat Inst, Philadelphia, PA 19104 USA; Rice Univ, Dept Phys, Houston, TX 77005 USA; Rice Univ, Dept Astron, Houston, TX 77005 USA; Northwestern Univ, Dept Mat Sci & Engn, Evanston, IL 60208 USA; Northwestern Univ, Dept Chem, Evanston, IL 60208 USA; Northwestern Univ, Dept Med, Evanston, IL 60208 USA; Univ Hosp, CH-4056 Basel, Switzerland; European Fdn Clin Nanomed, CLINAM, CH-4058 Basel, Switzerland; Zhejiang Univ, Dept Polymer Sci & Engn, Hangzhou 310027, Zhejiang, Peoples R China; Zhejiang Univ, Ctr Bionanoengn, Hangzhou 310027, Zhejiang, Peoples R China; Zhejiang Univ, Dept Chem & Biol Engn, Hangzhou 310027, Zhejiang, Peoples R China; Univ Klinikum Heidelberg, Thoraxklin Heidelberg, D-69120 Heidelberg, Germany; Univ Tokyo, Bunkyo Ku, Tokyo 1138654, Japan; Harvard Univ, Cambridge, MA 02139 USA; Univ Utah, Biomed Polymers Lab, Salt Lake City, UT 84112 USA; Univ Michigan, Emergency Med, Ann Arbor, MI 48019 USA; Fed Inst Mat Sci & Technol, EMPA, CH-9014 St Gallen, Switzerland; Seoul Natl Univ, Dept Mol Med & Biopharmaceut Sci, Seoul, South Korea; Seoul Natl Univ, Sch Chem & Biol Engn, Seoul, South Korea; Univ Saarland, Dept Pharm, D-66123 Saarbrucken, Germany; Helmholtz Center Infect Res, HIPS Helmhotz Inst Pharmaceut Res Saarland, D-66123 Saarbrucken, Germany; Columbia Univ, Dept Biomed Engn, New York, NY 10027 USA; Chinese Acad Sci, Lab Controllable Nanopharmaceut, Beijing 100190, Peoples R China; Ciber BBN, Biomed Res Networking Ctr Bioengn Biomat & Nanome, San Sebastian 20014, Spain; Kazan Fed Univ, Lab Bioengn Regenerat Med BioReM, Kazan 420008, Russia; Max Planck Inst Colloids & Interfaces, Dept Interfaces, D-14476 Potsdam, Germany; Emory Univ, Atlanta, GA 30322 USA; Tokyo Womens Med Univ, Tokyo 1628666, Japan; Wiley VCH, SMALL, Weinheim, Germany; Adv Inst Convergence Technol, Suwon, South Korea; Univ Calif Irvine, Dept Chem, Irvine, CA 92697 USA; UAB, Inst Catala Nanotecnol, Barcelona 08193, Spain; Vall Hebron Univ Hosp, Inst Res, Barcelona 08035, Spain; Univ Massachusetts, Dept Chem, Amherst, MA 01003 USA; Penn State Univ, Dept Chem, University Pk, PA 16802 USA; Univ Ghent, Dept Mol Biotechnol, B-9000 Ghent, Belgium; Univ London Imperial Coll Sci Technol & Med, Inst Biomed Engn, Dept Bioengn, Dept Mat, London SW7 2AZ, England; Chinese Natl Engn Res Ctr Tissue Restorat & Recon, Hong Kong Branch, Hong Kong, Hong Kong, Peoples R China; Natl Tsing Hua Univ, Dept Chem Engn, Hsinchu, Taiwan; Natl Tsing Hua Univ, Inst Biomed Engn, Hsinchu, Taiwan; Univ Ulm, Inst Organ Chem, D-89081 Ulm, Germany; Max Planck Inst Polymer Res, D-55128 Mainz, Germany; Hebrew Univ Jerusalem, Ctr Nanosci & Nanotechnol, Inst Chem, IL-91904 Jerusalem, Israel; Huazhong Univ Sci & Technol, Sch Chem & Chem Engn, Wuhan 430074, Peoples R China; Peking Univ, Sch Pharmaceut Sci, Beijing 100191, Peoples R China; Chinese Acad Sci, Inst Biophys, CAS Ctr Excellence Biomacromol, Natl Lab Biomacromol, 15 Datun Rd, Beijing, Peoples R China; Chinese Acad Sci, Wuhan Inst Phys & Math, State Key Lab Magnet Resonance & Atom & Mol Phys, Natl Ctr Magnet Resonance Wuhan,Key Lab Magnet Re, Wuhan 430071, Peoples R China"
139,"Hsieh, D; Qian, D; Wray, L; Xia, Y; Hor, YS; Cava, RJ; Hasan, MZ","Princeton Univ, Dept Phys, Joseph Henry Labs Phys, Princeton, NJ 08544 USA; Princeton Univ, Dept Chem, Princeton, NJ 08544 USA; Princeton Univ, Princeton Inst Sci & Technol Mat, Princeton Ctr Complex Mat, Princeton, NJ 08544 USA"
140,"Gibertini, M; Koperski, M; Morpurgo, AF; Novoselov, KS","Univ Geneva, Dept Quantum Matter Phys, Geneva, Switzerland; Ecole Polytech Fed Lausanne, Natl Ctr Computat Design & Discovery Novel Mat Ma, Lausanne, Switzerland; Univ Manchester, Sch Phys & Astron, Manchester, Lancs, England; Univ Manchester, Natl Graphene Inst, Manchester, Lancs, England; Univ Geneva, Grp Appl Phys, Geneva, Switzerland"
141,"Horodecki, R; Horodecki, P; Horodecki, M; Horodecki, K","Univ Gdansk, Inst Theoret Phys & Astrophys, PL-80952 Gdansk, Poland; Gdansk Univ Technol, Fac Appl Phys & Math, PL-80952 Gdansk, Poland; Univ Gdansk, Fac Math Phys & Comp Sci, PL-80952 Gdansk, Poland"
142,"Xu, FY; Zhang, JJ; Zhu, BC; Yu, JG; Xu, JS","Wuhan Univ Technol, State Key Lab Adv Technol Mat Synth & Proc, Luoshi Rd 122, Wuhan 430070, Hubei, Peoples R China; King Abdulaziz Univ, Fac Sci, Dept Phys, Jeddah 21589, Saudi Arabia; Queensland Univ Technol, Sch Chem Phys & Mech Engn, Brisbane, Qld 4000, Australia"
143,"Ozawa, T; Price, HM; Amo, A; Goldman, N; Hafezi, M; Lu, L; Rechtsman, MC; Schuster, D; Simon, J; Zilberberg, O; Carusotto, I","RIKEN, Interdisciplinary Theoret & Math Sci Program iTHE, Wako, Saitama 3510198, Japan; Univ Libre Bruxelles, Ctr Nonlinear Phenomena & Complex Syst, CP 231,Campus Plaine, B-1050 Brussels, Belgium; Univ Trento, INO CNR BEC Ctr, I-38123 Povo, Italy; Univ Trento, Dipartimento Fis, I-38123 Povo, Italy; Univ Birmingham, Sch Phys & Astron, Birmingham B15 2TT, W Midlands, England; Univ Lille, CNRS, UMR 8523, Lab Phys Lasers Atomes & Mol,PhLAM, F-59000 Lille, France; Univ Maryland, Inst Res Elect & Appl Phys, Joint Quantum Inst, Dept Elect & Comp Engn,Dept Phys, College Pk, MD 20742 USA; Chinese Acad Sci, Beijing Natl Lab Condensed Matter Phys, Inst Phys, Beijing 100190, Peoples R China; Songshan Lake Mat Lab, Dongguan 523808, Guangdong, Peoples R China; Penn State Univ, Dept Phys, 104 Davey Lab, University Pk, PA 16802 USA; Univ Chicago, James Franck Inst, 5640 S Ellis Ave, Chicago, IL 60637 USA; Univ Chicago, Dept Phys, Chicago, IL 60637 USA; Swiss Fed Inst Technol, Inst Theoret Phys, CH-8093 Zurich, Switzerland"
144,"Bandurin, DA; Tyurnina, AV; Yu, GL; Mishchenko, A; Zolyomi, V; Morozov, SV; Kumar, RK; Gorbachev, RV; Kudrynskyi, ZR; Pezzini, S; Kovalyuk, ZD; Zeitler, U; Novoselov, KS; Patane, A; Eaves, L; Grigorieva, IV; Fal'ko, VI; Geim, AK; Cao, Y","Univ Manchester, Sch Phys & Astron, Oxford Rd, Manchester M13 9PL, Lancs, England; Skolkovo Inst Sci & Technol, Nobel St 3, Moscow 143026, Russia; Univ Manchester, Natl Graphene Inst, Manchester M13 9PL, Lancs, England; RAS, Inst Microelect Technol & High Purity Mat, Chernogolovka 142432, Russia; Natl Univ Sci & Technol MISiS, Leninsky Pr 4, Moscow 119049, Russia; Univ Nottingham, Sch Phys & Astron, Nottingham NG7 2RD, England; Radboud Univ Nijmegen, High Field Magnet Lab HFML EMFL, Toernooiveld 7, NL-6525 ED Nijmegen, Netherlands; Natl Acad Sci Ukraine, Inst Problems Mat Sci, UA-58001 Chernovtsy, Ukraine"
145,"Schmidt, LC; Pertegas, A; Gonzalez-Carrero, S; Malinkiewicz, O; Agouram, S; Espallargas, GM; Bolink, HJ; Galian, RE; Perez-Prieto, J","Univ Valencia, Inst Ciencia Mol ICMol, Valencia 46980, Spain; Univ Valencia, Dept Appl Phys & Electromagnetism, E-46100 Burjassot, Spain"
146,"Krausz, F; Ivanov, M","Univ Munich, Dept Phys, D-85748 Garching, Germany; Natl Res Council Canada, Steacie Inst Mol Sci, Ottawa, ON K1A 0R6, Canada; Max Planck Inst Quantum Opt, D-85748 Garching, Germany"
147,"Coughlan, C; Ibanez, M; Dobrozhan, O; Singh, A; Cabot, A; Ryan, KM","Univ Limerick, Dept Chem Sci, Limerick, Ireland; Univ Limerick, Bernal Inst, Limerick, Ireland; Catalonia Energy Res Inst IREC, Jardins Dones Negre 1,Pl 2, Barcelona 08930, Spain; Sumy State Univ, Dept Elect & Comp, 2 Rymskogo Korsakova St, UA-40007 Sumy, Ukraine; Los Alamos Natl Lab, Ctr Integrated Nanotechnol, Mat Phys & Applicat Div, Los Alamos, NM 87545 USA; Pg Lluis Co 23, ICREA, Barcelona 08010, Spain"
148,"Wang, H; Yang, XZ; Shao, W; Chen, SC; Xie, JF; Zhang, XD; Wang, J; Xie, Y","Univ Sci & Technol China, Hefei Natl Lab Phys Sci Microscale, Collaborat Innovat Ctr Chem Energy Mat, Hefei 230026, Anhui, Peoples R China; Univ Sci & Technol China, Sch Life Sci, Hefei 230027, Anhui, Peoples R China"
149,"Lu, SY; Sui, LZ; Liu, JJ; Zhu, SJ; Chen, AM; Jin, MX; Yang, B","Jilin Univ, Coll Chem, State Key Lab Supramol Struct & Mat, Changchun 130012, Peoples R China; Zhengzhou Univ, Coll Chem & Mol Engn, Zhengzhou 450000, Peoples R China; Jilin Univ, Inst Atom & Mol Phys, Changchun 130012, Peoples R China; Jilin Univ, Jilin Prov Key Lab Appl Atom & Mol Spect, Changchun 130012, Peoples R China"
150,"Novoselov, KS; Jiang, Z; Zhang, Y; Morozov, SV; Stormer, HL; Zeitler, U; Maan, JC; Boebinger, GS; Kim, P; Geim, AK","Univ Manchester, Dept Phys, Manchester M13 9PL, Lancs, England; Columbia Univ, Dept Phys, New York, NY 10027 USA; Natl High Magnet Field Lab, Tallahassee, FL 32310 USA; Univ Nijmegen St Radboud Hosp, High Field Magnet Lab, NL-6525 ED Nijmegen, Netherlands"
