,authors_full,affiliation
211,"Luo, DY; Su, R; Zhang, W; Gong, QH; Zhu, R","Peking Univ, State Key Lab Artificial Microstruct & Mesoscop P, Frontiers Sci Ctr Nanooptoelect & Collaborat Inno, Sch Phys,Ctr Quantum Matter, Beijing 100871, Peoples R China; Univ Surrey, Adv Technol Inst, Guildford GU2 7XH, Surrey, England; Zhengzhou Univ, SCICDLCEM, Sch Mat Sci & Engn, Zhengzhou 450001, Peoples R China; Shanxi Univ, Collaborat Innovat Ctr Extreme Opt, Taiyuan 030006, Shanxi, Peoples R China"
212,"Yuan, HT; Liu, XG; Afshinmanesh, F; Li, W; Xu, G; Sun, J; Lian, B; Curto, AG; Ye, GJ; Hikita, Y; Shen, ZX; Zhang, SC; Chen, XH; Brongersma, M; Hwang, HY; Cui, Y","Stanford Univ, Geballe Lab Adv Mat, Stanford, CA 94305 USA; Stanford Inst Mat & Energy Sci, SLAC Natl Accelerator Lab, Menlo Pk, CA 94025 USA; Univ Sci & Technol China, Hefei Natl Lab Phys Sci Microscale, Hefei 230026, Anhui, Peoples R China; Univ Sci & Technol China, Dept Phys, Hefei 230026, Anhui, Peoples R China; Chinese Acad Sci, Key Lab Strongly Coupled Quantum Matter Phys, Hefei 230026, Anhui, Peoples R China; Chinese Acad Sci, High Field Magnet Lab, Hefei 230031, Anhui, Peoples R China; Nanjing Univ, Collaborat Innovat Ctr Adv Microstruct, Nanjing 210093, Jiangsu, Peoples R China"
213,"Huang, B; Clark, G; Klein, DR; MacNeill, D; Navarro-Moratalla, E; Seyler, KL; Wilson, N; McGuire, MA; Cobden, DH; Xiao, D; Yao, W; Jarillo-Herrero, P; Xu, XD","Univ Washington, Dept Phys, Seattle, WA 98195 USA; Univ Washington, Dept Mat Sci & Engn, Seattle, WA 98195 USA; MIT, Dept Phys, Cambridge, MA 02139 USA; Univ Valencia, Inst Ciencia Mol, Paterna, Spain; Oak Ridge Natl Lab, Mat Sci & Technol Div, Oak Ridge, TN USA; Carnegie Mellon Univ, Dept Phys, Pittsburgh, PA 15213 USA; Univ Hong Kong, Dept Phys, Hong Kong, Hong Kong, Peoples R China; Univ Hong Kong, Ctr Theoret & Computat Phys, Hong Kong, Hong Kong, Peoples R China"
214,"Deschler, F; Price, M; Pathak, S; Klintberg, LE; Jarausch, DD; Higler, R; Huttner, S; Leijtens, T; Stranks, SD; Snaith, HJ; Atature, M; Phillips, RT; Friend, RH","Univ Cambridge, Cavendish Lab, Cambridge CB3 0HE, England; Univ Oxford, Clarendon Lab, Oxford OX1 3PU, England"
215,"Chao, DL; Zhu, CR; Xia, XH; Liu, JL; Zhang, X; Wang, J; Liang, P; Lin, JY; Zhang, H; Shen, ZX; Fan, HJ","Nanyang Technol Univ, Sch Phys & Math Sci, Singapore 637371, Singapore; Nanyang Technol Univ, Sch Mat Sci & Engn, Singapore 639798, Singapore; Nanyang Technol Univ, Energy Res Inst, Singapore 639798, Singapore; China Jiliang Univ, Coll Optic & Elect Technol, Hangzhou 310038, Zhejiang, Peoples R China"
216,"Ahmadi, M; Wu, T; Hu, B","Univ Tennessee, Dept Mat Sci & Engn, Joint Inst Adv Mat, Knoxville, TN 37996 USA; Beijing Jiaotong Univ, Coll Sci, Beijing 100044, Peoples R China"
217,"Yang, B; Chen, JS; Hong, F; Mao, X; Zheng, KB; Yang, SQ; Li, YJ; Pullerits, T; Deng, WQ; Han, KL","Chinese Acad Sci, Dalian Inst Chem Phys, State Key Lab Mol React Dynam, Dalian 116023, Peoples R China; Univ Chinese Acad Sci, Beijing 100039, Peoples R China; Lund Univ, Dept Chem Phys, POB 124, S-22100 Lund, Sweden; Lund Univ, NanoLund Chem Ctr, POB 124, S-22100 Lund, Sweden"
218,"Zhang, N; Jalil, A; Wu, DX; Chen, SM; Liu, YF; Gao, C; Ye, W; Qi, ZM; Ju, HX; Wang, CM; Wu, XJ; Song, L; Zhu, JF; Xiong, YJ","Univ Sci & Technol China, Hefei Natl Lab Phys Sci Microscale, iChEM Collaborat Innovat Ctr Chem Energy Mat, Sch Chem & Mat Sci, Hefei 230026, Anhui, Peoples R China; Univ Sci & Technol China, Natl Synchrotron Radiat Lab, Hefei 230026, Anhui, Peoples R China"
219,"Tan, CL; Luo, ZM; Chaturvedi, A; Cai, YQ; Du, YH; Gong, Y; Huang, Y; Lai, ZC; Zhang, X; Zheng, LR; Qi, XY; Goh, MH; Wang, J; Han, SK; Wu, XJ; Gu, L; Kloc, C; Zhang, H","Nanyang Technol Univ, Sch Mat Sci & Engn, Ctr Programmable Mat, 50 Nanyang Ave, Singapore 639798, Singapore; ASTAR, Inst High Performance Comp, 1 Fusionopolis Way, Singapore 138632, Singapore; ASTAR, Inst Chem & Engn Sci, Singapore 627833, Singapore; Chinese Acad Sci, Inst Phys, Beijing Natl Lab Condensed Matter Phys, Beijing 100190, Peoples R China; Chinese Acad Sci, Inst High Energy Phys, Beijing Synchrotron Radiat Facil, Beijing 100049, Peoples R China; ASTAR, Singapore Inst Mfg Technol, 71 Nanyang Dr, Singapore 638075, Singapore"
220,"Liu, XK; Xu, WD; Bai, S; Jin, YZ; Wang, JP; Friend, RH; Gao, F","Linkoping Univ, Dept Phys Chem & Biol IFM, Linkoping, Sweden; Zhejiang Univ, State Key Lab Silicon Mat, Ctr Chem High Performance & Novel Mat, Hangzhou, Peoples R China; Zhejiang Univ, Dept Chem, Hangzhou, Peoples R China; Nanjing Tech Univ NanjingTech, Inst Adv Mat IAM, Key Lab Flexible Elect KLOFE, Nanjing, Peoples R China; Univ Cambridge, Cavendish Lab, Cambridge, England"
221,"Wang, H; Liu, FC; Fu, W; Fang, ZY; Zhou, W; Liu, Z","Nanyang Technol Univ, Sch Mat Sci & Engn, Singapore 639798, Singapore; Peking Univ, State Key Lab Mesoscop Phys, Sch Phys, Beijing 100871, Peoples R China; Collaborat Innovat Ctr Quantum Matter, Beijing 100871, Peoples R China; Rice Univ, Dept Elect & Comp Engn, Houston, TX 77005 USA; Rice Univ, Lab Nanophoton, Houston, TX 77005 USA; Oak Ridge Natl Lab, Mat Sci & Technol Div, Oak Ridge, TN 37831 USA; Nanyang Technol Univ, Sch Elect & Elect Engn, Nanoelect Ctr Excellence, NOVITAS, Singapore 639798, Singapore; CINTRA CNRS NTU THALES, UMI 3288, Singapore 637553, Singapore"
222,"Ladd, TD; Jelezko, F; Laflamme, R; Nakamura, Y; Monroe, C; O'Brien, JL","Univ Bristol, Ctr Quantum Photon, HH Wills Phys Lab, Bristol BS8 1UB, Avon, England; Univ Bristol, Dept Elect & Elect Engn, Bristol BS8 1UB, Avon, England; Stanford Univ, Edward L Ginzton Lab, Stanford, CA 94305 USA; Univ Stuttgart, Inst Phys 3, D-70550 Stuttgart, Germany; Univ Waterloo, Inst Quantum Comp, Waterloo, ON N2L 3G1, Canada; Univ Waterloo, Dept Phys & Astron, Waterloo, ON N2L 3G1, Canada; Perimeter Inst, Waterloo, ON N2L 2Y5, Canada; NEC Corp Ltd, Nano Elect Res Labs, Tsukuba, Ibaraki 3058501, Japan; RIKEN, Inst Phys & Chem Res, Wako, Saitama 3510198, Japan; Univ Maryland, Dept Phys, Joint Quantum Inst, College Pk, MD 20742 USA; NIST, College Pk, MD 20742 USA"
223,"Luo, DY; Yang, WQ; Wang, ZP; Sadhanala, A; Hu, Q; Su, R; Shivanna, R; Trindade, GF; Watts, JF; Xu, ZJ; Liu, TH; Chen, K; Ye, FJ; Wu, P; Zhao, LC; Wu, J; Tu, YG; Zhang, YF; Yang, XY; Zhang, W; Friend, RH; Gong, QH; Snaith, HJ; Zhu, R","Peking Univ, Dept Phys, State Key Lab Artificial Microstruct & Mesoscop P, Beijing 100871, Peoples R China; Collaborat Innovat Ctr Quantum Matter, Beijing 100871, Peoples R China; Univ Oxford, Dept Phys, Clarendon Lab, Parks Rd, Oxford OX1 3PU, England; Cavendish Lab, JJ Thomson Ave, Cambridge CB3 0HE, England; Univ Surrey, Fac Engn & Phys Sci, Surface Anal Lab, Guildford GU2 7XH, Surrey, England; Univ Surrey, Adv Technol Inst, Guildford GU2 7XH, Surrey, England; Shanxi Univ, Collaborat Innovat Ctr Extreme Opt, Taiyuan 030006, Shanxi, Peoples R China"
224,"Shao, JD; Xie, HH; Huang, H; Li, ZB; Sun, ZB; Xu, YH; Xiao, QL; Yu, XF; Zhao, YT; Zhang, H; Wang, HY; Chu, PK","Chinese Acad Sci, Shenzhen Inst Adv Technol, Inst Biomed & Biotechnol, Shenzhen 518055, Peoples R China; Shenzhen Univ, SZU NUS Collaborat Innovat Ctr Optoelect Sci & Te, Shenzhen 518060, Peoples R China; Shenzhen Univ, Key Lab Optoelect Devices & Syst, Minist Educ & Guangdong Prov, Coll Optoelect Engn, Shenzhen 518060, Peoples R China; City Univ Hong Kong, Dept Phys & Mat Sci, Tat Chee Ave, Kowloon 999077, Hong Kong, Peoples R China"
225,"Zhang, XY; Lin, H; Huang, H; Reckmeier, C; Zhang, Y; Choy, WCH; Rogach, AL","City Univ Hong Kong, Dept Phys & Mat Sci, Kowloon, Hong Kong, Peoples R China; City Univ Hong Kong, Ctr Funct Photon, Kowloon, Hong Kong, Peoples R China; Jilin Univ, State Key Lab Integrated Optoelect, Changchun 130012, Peoples R China; Jilin Univ, Coll Elect Sci & Engn, Changchun 130012, Peoples R China; Univ Hong Kong, Dept Elect & Elect Engn, Pokfulam Rd, Hong Kong, Hong Kong, Peoples R China"
226,"Ding, HL; Zhang, YX; Wang, S; Xu, JM; Xu, SC; Li, GH","Chinese Acad Sci, Inst Solid State Phys, Key Lab Mat Phys, Anhui Key Lab Nanomat & Nanotechnol, Hefei 230031, Peoples R China"
227,"Yu, P; Besteiro, LV; Huang, YJ; Wu, J; Fu, L; Tan, HH; Jagadish, C; Wiederrecht, GP; Govorov, AO; Wang, ZM","Univ Elect Sci & Technol China, Inst Fundamental & Frontier Sci, Chengdu 610054, Sichuan, Peoples R China; Australian Natl Univ, Res Sch Phys & Engn, Dept Elect Mat & Engn, Canberra, ACT 0200, Australia; Inst Natl Rech Sci Energie Mat Telecommun, Varennes, PQ J3X 1S2, Canada; Univ Elect Sci & Technol China, Sch Informat & Commun Engn, Chengdu 611731, Sichuan, Peoples R China; Argonne Natl Lab, Ctr Nanoscale Mat, Lemont, IL 60439 USA; Ohio Univ, Dept Phys & Astron, Athens, OH 45701 USA"
228,"Wang, Y; Liu, XQ; Liu, J; Han, B; Hu, XQ; Yang, F; Xu, ZW; Li, YC; Jia, SR; Li, Z; Zhao, YL","China Univ Geosci, Fac Mat Sci & Chem, Minist Educ, Engn Res Ctr Nanogeomat, Wuhan 430074, Hubei, Peoples R China; Nanyang Technol Univ, Sch Phys & Math Sci, Div Chem & Biol Chem, 21 Nanyang Link, Singapore 637371, Singapore; Huazhong Univ Sci & Technol, Sch Energy & Power Engn, State Key Lab Coal Combust, Wuhan 430074, Hubei, Peoples R China"
229,"Yang, W; Chen, GR; Shi, ZW; Liu, CC; Zhang, LC; Xie, GB; Cheng, M; Wang, DM; Yang, R; Shi, DX; Watanabe, K; Taniguchi, T; Yao, YG; Zhang, YB; Zhang, GY","Chinese Acad Sci, Beijing Natl Lab Condensed Matter Phys, Beijing 100190, Peoples R China; Fudan Univ, State Key Lab Surface Phys, Shanghai 200433, Peoples R China; Fudan Univ, Dept Phys, Shanghai 200433, Peoples R China; Beijing Inst Technol, Sch Phys, Beijing 100081, Peoples R China; Kunming Univ, Dept Phys, Kunming 650214, Peoples R China; Natl Inst Mat Sci, Adv Mat Lab, Tsukuba, Ibaraki 3050044, Japan"
230,"Yakunin, S; Protesescu, L; Krieg, F; Bodnarchuk, MI; Nedelcu, G; Humer, M; De Luca, G; Fiebig, M; Heiss, W; Kovalenko, MV","ETH, Dept Chem & Appl Biosci, Inorgan Chem Lab, CH-8093 Zurich, Switzerland; Empa Swiss Fed Labs Mat Sci & Technol, Lab Thin Films & Photovolta, CH-8600 Dubendorf, Switzerland; Univ Linz, Inst Semicond & Solid State Phys, A-4040 Linz, Austria; ETH, Dept Mat, Lab Multifunct Ferro Mat, CH-8093 Zurich, Switzerland; Univ Erlangen Nurnberg, Mat Elect & Energy Technol I MEET, D-91058 Erlangen, Germany; Energie Campus Nurnberg EnCN, D-90429 Nurnberg, Germany"
231,"Zeng, DQ; Xu, WJ; Ong, WJ; Xu, J; Ren, H; Chen, YZ; Zheng, HF; Peng, DL","Xiamen Univ, Coll Mat, Collaborat Innovat Ctr Chem Energy Mat, Dept Mat Sci & Engn, Xiamen 361005, Peoples R China; Agcy Sci Technol & Res, Inst Mat Res & Engn, 2 Fusionopolis Way, Singapore 138634, Singapore; Xiamen Univ, Coll Chem & Chem Engn, State Key Lab Phys Chem Solid Surfaces, Xiamen 361005, Peoples R China; Xiamen Univ, Coll Chem & Chem Engn, Dept Chem, Xiamen 361005, Peoples R China"
232,"Ando, Y","Osaka Univ, Inst Sci & Ind Res, Osaka 5670047, Japan"
233,"Li, M; Cushing, SK; Wu, NQ","W Virginia Univ, Dept Mech & Aerosp Engn, Morgantown, WV 26506 USA; W Virginia Univ, Dept Phys & Astron, Morgantown, WV 26506 USA"
234,"Robel, I; Subramanian, V; Kuno, M; Kamat, PV","Univ Notre Dame, Notre Dame Radiat Lab, Notre Dame, IN 46556 USA; Univ Notre Dame, Dept Chem & Biochem, Notre Dame, IN 46556 USA; Univ Notre Dame, Dept Chem & Biomol Engn, Notre Dame, IN 46556 USA; Univ Notre Dame, Dept Phys, Notre Dame, IN 46556 USA"
235,"Marago, OM; Jones, PH; Gucciardi, PG; Volpe, G; Ferrari, AC","CNR, IPCF, I-98158 Messina, Italy; UCL, Dept Phys & Astron, London WC1E 6BT, England; Bilkent Univ, Dept Phys, TR-06800 Ankara, Turkey; Univ Cambridge, Cambridge Graphene Ctr, Cambridge CB3 0FA, England"
236,"Mourik, V; Zuo, K; Frolov, SM; Plissard, SR; Bakkers, EPAM; Kouwenhoven, LP","Delft Univ Technol, Kavli Inst Nanosci, NL-2600 GA Delft, Netherlands; Eindhoven Univ Technol, Dept Appl Phys, NL-5600 MB Eindhoven, Netherlands"
237,"Pearton, SJ; Zolper, JC; Shul, RJ; Ren, F","Univ Florida, Dept Mat Sci & Engn, Gainesville, FL 32611 USA; Off Naval Res, Arlington, VA 22217 USA; Sandia Natl Labs, Albuquerque, NM 87185 USA; Univ Florida, Dept Chem Engn, Gainesville, FL 32611 USA"
238,"Koppens, FHL; Chang, DE; de Abajo, FJG","ICFO Inst Ciencies Foton, Castelldefels 08860, Barcelona, Spain; CALTECH, Pasadena, CA 91125 USA; CSIC, Inst Opt, E-28006 Madrid, Spain; Univ Southampton, Optoelect Res Ctr, Southampton SO17 1BJ, Hants, England"
239,"Chen, HB; Gu, ZJ; An, HW; Chen, CY; Chen, J; Cui, R; Chen, SQ; Chen, WH; Chen, XS; Chen, XY; Chen, Z; Ding, BQ; Dong, Q; Fan, Q; Fu, T; Hou, DY; Jiang, Q; Ke, HT; Jiang, XQ; Liu, G; Li, SP; Li, TY; Liu, Z; Nie, GJ; Ovais, M; Pang, DW; Qiu, NS; Shen, YQ; Tian, HY; Wang, C; Wang, H; Wang, ZQ; Xu, HP; Xu, JF; Yang, XL; Zhu, S; Zheng, XC; Zhang, XZ; Zhao, YB; Tan, WH; Zhang, X; Zhao, YL","Soochow Univ, Coll Pharmaceut Sci, Jiangsu Key Lab Neuropsychiat Dis, State Key Lab Radiat Med & Protect, Suzhou 215123, Peoples R China; Chinese Acad Sci, Inst High Energy Phys, Beijing 100049, Peoples R China; Natl Ctr Nanosci & Technol China, CAS Ctr Excellence Nanosci, CAS Key Lab Biomed Effects Nanomat & Nanosafety, Beijing 100190, Peoples R China; Univ Chinese Acad Sci, Beijing 100049, Peoples R China; Chinese Acad Sci, Changchun Inst Appl Chem, Key Lab Polymer Ecomat, Changchun 130022, Jilin, Peoples R China; Univ Sci & Technol China, Hefei 230026, Anhui, Peoples R China; Jilin Biomed Polymers Engn Lab, Changchun 130022, Jilin, Peoples R China; Wuhan Univ, Key Lab Analyt Chem Biol & Med, Minist Educ, Coll Chem & Mol Sci,State Key Lab Virol, Wuhan 430072, Hubei, Peoples R China; Wuhan Univ, Inst Adv Studies, Wuhan 430072, Hubei, Peoples R China; Zhejiang Univ, Ctr Bionanoengn, Hangzhou 310027, Zhejiang, Peoples R China; Zhejiang Univ, Coll Chem & Biol Engn, Minist Educ, Key Lab Biomass Chem Engn, Hangzhou 310027, Zhejiang, Peoples R China; Wuhan Univ, Dept Chem, Minist Educ, Key Lab Biomed Polymers, Wuhan 430072, Hubei, Peoples R China; Natl Inst Biomed Imaging & Bioengn, Lab Mol Imaging & Nanomed, NIH, Bethesda, MD 20892 USA; Hunan Univ, Aptamer Engn Ctr Hunan Prov, State Key Lab Chemo Biosensing & Chemometr, Coll Chem & Chem Engn,Mol Sci & Biomed Lab, Changsha 410082, Hunan, Peoples R China; Soochow Univ, Inst Funct Nano & Soft Mat, Jiangsu Key Lab Carbon Based Funct Mat & Devices, Suzhou 215123, Peoples R China; Nanjing Univ, Coll Chem & Chem Engn, Dept Polymer Sci & Engn, Nanjing 210093, Jiangsu, Peoples R China; Xiamen Univ, Sch Publ Hlth, State Key Lab Mol Vaccinol & Mol Diagnost, Xiamen 361102, Peoples R China; Xiamen Univ, Sch Publ Hlth, Ctr Mol Imaging & Translat Med, Xiamen 361102, Peoples R China; Tsinghua Univ, Dept Chem, Beijing 100084, Peoples R China; Huazhong Univ Sci & Technol, Coll Life Sci & Technol, Natl Engn Res Ctr Nanomed, Wuhan 430074, Hubei, Peoples R China; Univ Florida, Dept Chem, Gainesville, FL 32611 USA; Univ Florida, Ctr Res Bionano Interface, Hlth Canc Ctr, Dept Physiol & Funct Genom,UF Genet Inst, Gainesville, FL 32611 USA; Univ Florida, McKnight Brain Inst, Gainesville, FL 32611 USA"
240,"Naseri, A; Samadi, M; Pourjavadi, A; Moshfegh, AZ; Ramakrishna, S","Sharif Univ Technol, Inst Nanosci & Nanotechnol, Tehran 145888969, Iran; Natl Univ Singapore, NUS Ctr Nanofibers & Nanotechnol, Singapore 117583, Singapore; Sharif Univ Technol, SERI, Tehran 1459777611, Iran; Sharif Univ Technol, Dept Phys, Tehran 115559161, Iran; Sharif Univ Technol, Dept Chem, Tehran 115559516, Iran"
241,"Xu, HB; Zhou, SH; Xiao, LL; Wang, HH; Li, SZ; Yuan, QH","Chinese Acad Sci, Key Lab Funct Mat & Devices Special Environm, Xinjiang Tech Inst Phys & Chem, Lab Environm Sci & Technol, Urumqi 830011, Xinjiang, Peoples R China; Univ Chinese Acad Sci, Beijing 100049, Peoples R China"
242,"Liu, F; Jang, MH; Ha, HD; Kim, JH; Cho, YH; Seo, TS","Korea Adv Inst Sci & Technol, Dept Chem & Biomol Engn, Program BK21, Taejon 305701, South Korea; Korea Adv Inst Sci & Technol, Inst BioCentury, Taejon 305701, South Korea; Korea Adv Inst Sci & Technol, Dept Phys, Grad Sch Nanosci & Technol WCU, Taejon 305701, South Korea; Korea Adv Inst Sci & Technol, Graphene Res Ctr KI NanoCentury, Taejon 305701, South Korea"
243,"Chen, G; Dresselhaus, MS; Dresselhaus, G; Fleurial, JP; Caillat, T","MIT, Dept Mech Engn, Cambridge, MA 02139 USA; MIT, Dept Elect Engn & Comp Sci, Dept Phys, Cambridge, MA 02139 USA; MIT, Francis Bitter Natl Magnet Lab, Cambridge, MA 02139 USA; CALTECH, Jet Prop Lab, Pasadena, CA 91109 USA"
244,"Xia, CL; Zhu, SJ; Feng, TL; Yang, MX; Yang, B","Jilin Univ, Coll Chem, State Key Lab Supramol Struct & Mat, Changchun 130012, Jilin, Peoples R China; Natl Inst Biomed Imaging & Bioengn, Lab Mol Imaging & Nanomed, NIH, 35 Convent Dr, Bethesda, MD 20892 USA; Chinese Acad Sci, Changchun Inst Opt Fine Mech & Phys, State Key Lab Appl Opt, Changchun 130033, Jilin, Peoples R China"
245,"Li, HJ; Zhou, Y; Tu, WG; Ye, JH; Zou, ZG","Nanjing Univ, Dept Phys, Inst Acoust, Key Lab Modern Acoust MOE, Nanjing 210093, Jiangsu, Peoples R China; Anhui Univ Technol, Inst Optoelect Informat Mat & Technol, Sch Math & Phys, Maanshan 243002, Anhui, Peoples R China; Nanjing Univ, Jiangsu Key Lab Nano Technol, Ecomat & Renewable Energy Res Ctr ERERC, Natl Lab Solid State Microstruct, Nanjing 210093, Jiangsu, Peoples R China; Nanjing Univ, Dept Phys, Nanjing 210093, Jiangsu, Peoples R China; Nanjing Univ, Collaborat Innovat Ctr Adv Microstruct, Nanjing 210093, Jiangsu, Peoples R China; Natl Inst Mat Sci, Environm Remediat Mat Unit, Tsukuba, Ibaraki 3050044, Japan; Tianjin Univ, Sch Mat Sci & Engn, TU NIMS Joint Reseach Ctr, Tianjin 300072, Peoples R China"
246,"Zhang, Y; Xia, XH; Liu, B; Deng, SJ; Xie, D; Liu, Q; Wang, YD; Wu, JB; Wang, XL; Tu, JP","Zhejiang Univ, State Key Lab Silicon Mat, Key Lab Adv Mat & Applicat Batteries Zhejiang Pro, Hangzhou 310027, Zhejiang, Peoples R China; Zhejiang Univ, Dept Mat Sci & Engn, Hangzhou 310027, Zhejiang, Peoples R China; Dongguan Univ Technol, Sch Environm & Civil Engn, Guangdong Engn & Technol Res Ctr Adv Nanomat, Dongguan 523808, Peoples R China; City Univ Hong Kong, Dept Phys, Kowloon, Hong Kong 999077, Peoples R China; Nanyang Polytech, Sch Engn, Singapore 569830, Singapore; Taizhou Univ, Zhejiang Prov Key Lab Cutting Tools, Taizhou 318000, Zhejiang, Peoples R China"
247,"Shevchenko, EV; Talapin, DV; Kotov, NA; O'Brien, S; Murray, CB","IBM Corp, Div Res, TJ Watson Res Ctr, Yorktown Heights, NY 10598 USA; Columbia Univ, Dept Appl Phys & Appl Math, New York, NY 10027 USA; Univ Michigan, Dept Chem Engn, Ann Arbor, MI 48109 USA"
248,"Bai, S; Jiang, J; Zhang, Q; Xiong, YJ","Univ Sci & Technol China, Hefei Natl Lab Phys Sci Microscale, Collaborat Innovat Ctr Chem Energy Mat, Synerget Innovat Ctr Quantum Informat & Quantum P, Hefei 230026, Anhui, Peoples R China; Univ Sci & Technol China, Sch Chem & Mat Sci, Hefei 230026, Anhui, Peoples R China"
249,"Wang, N; Cai, Y; Zhang, RQ","Hong Kong Univ Sci & Technol, Dept Phys, Hong Kong, Hong Kong, Peoples R China; Hong Kong Univ Sci & Technol, Inst Nano Sci & Technol, Hong Kong, Hong Kong, Peoples R China; City Univ Hong Kong, COSDAF, Hong Kong, Hong Kong, Peoples R China; City Univ Hong Kong, Dept Phys & Mat Sci, Hong Kong, Hong Kong, Peoples R China"
250,"Torma, P; Barnes, WL","Aalto Univ, COMP Ctr Excellence, Dept Appl Phys, FI-00076 Aalto, Finland; Univ Exeter, Sch Phys & Astron, Exeter EX4 4QL, Devon, England; Univ Twente, Complex Photon Syst COPS, MESA, Inst Nanotechnol, NL-7500 AE Enschede, Netherlands"
251,"Fei, RX; Yang, L","Washington Univ, Dept Phys, St Louis, MO 63130 USA"
252,"Long, GK; Sabatini, R; Saidaminov, MI; Lakhwani, G; Rasmita, A; Liu, XG; Sargent, EH; Gao, WB","Nanyang Technol Univ, Sch Phys & Math Sci, Div Phys & Appl Phys, Singapore, Singapore; Univ Sydney, ARC Ctr Excellence Exciton Sci, Sch Chem, Sydney, NSW, Australia; Univ Toronto, Dept Elect & Comp Engn, Toronto, ON, Canada; Univ Victoria, Ctr Adv Mat & Related Technol CAMTEC, Dept Chem & Elect & Comp Engn, Victoria, BC, Canada; Natl Univ Singapore, Dept Chem, Singapore, Singapore; Univ Nice, MajuLab, CNRS, NUS NTU Int Joint Res Unit UMI, Singapore, Singapore; Nanyang Technol Univ, Photon Inst, Singapore, Singapore; Nanyang Technol Univ, Ctr Disrupt Photon technol, Singapore, Singapore"
253,"Kang, J; Tongay, S; Zhou, J; Li, JB; Wu, JQ","Chinese Acad Sci, Inst Semicond, Beijing 100083, Peoples R China; Univ Calif Berkeley, Dept Mat Sci & Engn, Berkeley, CA 94720 USA; Univ Calif Berkeley, Lawrence Berkeley Natl Lab, Div Mat Sci, Berkeley, CA 94720 USA"
254,"Rogalski, A","Mil Univ Technol, Inst Appl Phys, PL-00908 Warsaw 49, Poland"
255,"Favron, A; Gaufres, E; Fossard, F; Phaneuf-L'Heureux, AL; Tang, NYW; Levesque, PL; Loiseau, A; Leonelli, R; Francoeur, S; Martel, R","Univ Montreal, RQMP, Montreal, PQ H3C 3J7, Canada; Univ Montreal, Dept Phys, Montreal, PQ H3C 3J7, Canada; Univ Montreal, Dept Chem, Montreal, PQ H3C 3J7, Canada; CNRS Onera, UMR 104, Lab Etude Microstruct, Chatillon, France; Polytech Montreal, RQMP, Montreal, PQ H3C 3A7, Canada; Polytech Montreal, Dept Genie Phys, Montreal, PQ H3C 3A7, Canada"
256,"Hu, X; Zhang, XD; Liang, L; Bao, J; Li, S; Yang, WL; Xie, Y","Univ Sci & Technol China, Hefei Natl Lab Phys Sci Microscale, Collaborat Innovat Ctr Chem Energy Mat, Hefei 230026, Anhui, Peoples R China"
257,"Spaldin, NA; Ramesh, R","Swiss Fed Inst Technol, Mat Theory, Zurich, Switzerland; Univ Calif Berkeley, Dept Mat Sci & Engn, Berkeley, CA USA; Univ Calif Berkeley, Dept Phys, Berkeley, CA USA; Lawrence Berkeley Natl Lab, Mat Sci Div, Berkeley, CA USA"
258,"Cramer, CJ; Truhlar, DG","Univ Minnesota, Dept Chem, Minneapolis, MN 55455 USA; Univ Minnesota, Inst Supercomp, Minneapolis, MN 55455 USA"
259,"Geng, ZG; Liu, Y; Kong, XD; Li, P; Li, K; Liu, ZY; Du, JJ; Shu, M; Si, R; Zeng, J","Univ Sci & Technol China, Dept Chem Phys, Microscale Key Lab Strongly Coupled Quantum Matte, Hefei Natl Lab Phys Sci,Chinese Acad Sci, Hefei 230026, Anhui, Peoples R China; Chinese Acad Sci, Shanghai Inst Appl Phys, Shanghai Synchrotron Radiat Facil, Shanghai 201204, Peoples R China"
260,"Yu, R; Zhang, W; Zhang, HJ; Zhang, SC; Dai, X; Fang, Z","Chinese Acad Sci, Beijing Natl Lab Condensed Matter Phys, Beijing 100190, Peoples R China; Chinese Acad Sci, Inst Phys, Beijing 100190, Peoples R China; Stanford Univ, Dept Phys, Stanford, CA 94305 USA; Tsinghua Univ, Ctr Adv Study, Beijing 100084, Peoples R China"
261,"Huang, ZF; Song, JJ; Pan, L; Wang, ZM; Zhang, XQ; Zou, JJ; Mi, WB; Zhang, XW; Wang, L","Tianjin Univ, Sch Chem Engn & Technol, Minist Educ, Key Lab Green Chem Technol, Tianjin 300072, Peoples R China; Collaborat Innovat Ctr Chem Sci & Engn Tianjin, Tianjin 300072, Peoples R China; Tianjin Univ, Fac Sci, Tianjin Key Lab Low Dimens Mat Phys & Preparat Te, Tianjin 300072, Peoples R China"
262,"Wang, QY; Li, Z; Zhang, WH; Zhang, ZC; Zhang, JS; Li, W; Ding, H; Ou, YB; Deng, P; Chang, K; Wen, J; Song, CL; He, K; Jia, JF; Ji, SH; Wang, YY; Wang, LL; Chen, X; Ma, XC; Xue, QK","Chinese Acad Sci, Inst Phys, Beijing 100190, Peoples R China; Tsinghua Univ, Dept Phys, State Key Lab Low Dimens Quantum Phys, Beijing 100084, Peoples R China"
263,"Hong, F; Zhang, F; Liu, Y; Yan, H","Arizona State Univ, Biodesign Inst, Tempe, AZ 85287 USA; Arizona State Univ, Sch Mol Sci, Tempe, AZ 85287 USA"
264,"Jiao, XC; Chen, ZW; Li, XD; Sun, YF; Gao, S; Yan, WS; Wang, CM; Zhang, Q; Lin, Y; Luo, Y; Xie, Y","Univ Sci & Technol China, Hefei Natl Lab Phys Sci Microscale,Dept Phys,CAS, Synerget Innovat Ctr Quantum Informat & Quantum P, Key Lab Strongly Coupled Quantum Matter Phys,Int, Hefei 230026, Anhui, Peoples R China"
265,"Cao, T; Wang, G; Han, WP; Ye, HQ; Zhu, CR; Shi, JR; Niu, Q; Tan, PH; Wang, E; Liu, BL; Feng, J","Peking Univ, Int Ctr Quantum Mat, Beijing 100871, Peoples R China; Chinese Acad Sci, Inst Phys, Beijing Natl Lab Condensed Matter Phys, Beijing 100190, Peoples R China; Chinese Acad Sci, Inst Semicond, State Key Lab Superlattices & Microstruct, Beijing 100083, Peoples R China; Univ Texas Austin, Dept Phys, Austin, TX USA"
266,"Huang, JK; Pu, J; Hsu, CL; Chiu, MH; Juang, ZY; Chang, YH; Chang, WH; Iwasa, Y; Takenobu, T; Li, LJ","Acad Sinica, Inst Atom & Mol Sci, Taipei 106, Taiwan; Waseda Univ, Dept Appl Phys, Tokyo 1698555, Japan; Natl Chiao Tung Univ, Dept Electrophys, Hsinchu 300, Taiwan; Univ Tokyo, Quantum Phase Elect Ctr, Sch Engn, Bunkyo Ku, Tokyo 1138654, Japan; Univ Tokyo, Dept Appl Phys, Sch Engn, Bunkyo Ku, Tokyo 1138654, Japan; China Med Univ Hosp, Dept Med Res, Taichung, Taiwan"
267,"Geng, ZG; Kong, XD; Chen, WW; Su, HY; Liu, Y; Cai, F; Wang, GX; Zeng, J","Univ Sci & Technol China, Chinese Acad Sci, Key Lab Strongly Coupled Quantum Matter Phys, Hefei Natl Lab Phys Sci Microscale,Dept Chem Phys, Hefei 230026, Anhui, Peoples R China; Chinese Acad Sci, Dalian Inst Chem Phys, CAS Ctr Excellence Nanosci, Dalian Natl Lab Clean Energy,State Key Lab Cataly, Dalian 116023, Peoples R China"
268,"Wan, XG; Turner, AM; Vishwanath, A; Savrasov, SY","Nanjing Univ, Natl Lab Solid State Microstruct, Nanjing 210093, Peoples R China; Nanjing Univ, Dept Phys, Nanjing 210093, Peoples R China; Univ Calif Berkeley, Dept Phys, Berkeley, CA 94720 USA; Univ Calif Berkeley, Lawrence Berkeley Lab, Div Mat Sci, Berkeley, CA 94720 USA; Univ Calif Davis, Dept Phys, Davis, CA 95616 USA"
269,"Alivisatos, AP; Johnsson, KP; Peng, XG; Wilson, TE; Loweth, CJ; Bruchez, MP; Schultz, PG","UNIV CALIF BERKELEY,LAWRENCE BERKELEY NATL LAB,INST MOL DESIGN,BERKELEY,CA 94701"
270,"Feng, BJ; Zhang, J; Zhong, Q; Li, WB; Li, S; Li, H; Cheng, P; Meng, S; Chen, L; Wu, KH","Chinese Acad Sci, Inst Phys, Beijing 100190, Peoples R China; Collaborat Innovat Ctr Quantum Matter, Beijing 100871, Peoples R China"
271,"Barth, JV; Costantini, G; Kern, K","Ecole Polytech Fed Lausanne, Inst Phys Nanostruct, CH-1015 Lausanne, Switzerland; Univ British Columbia, Dept Chem, Vancouver, BC V6T 1Z4, Canada; Univ British Columbia, Dept Phys & Astron, Vancouver, BC V6T 1Z4, Canada; Max Planck Inst Festkorperforsch, D-70569 Stuttgart, Germany"
